total_ratings,city,business_name,phone_number,address,profession,website,rating
180,Boston,Alarm New England Boston,+1 617-237-1684,curity system supplier · 2 Park Plaza #305,Security System Installers,https://www.alarmnewengland.com/home-security/boston,4.6
590,Boston,SafeStreets Home Security Boston,+1 774-224-2958,curity system installation service,Security System Installers,https://www.safestreets.com/ma/boston/?utm_source=gbp&utm_medium=organic&utm_campaign=gbp_massbost,5.0
10,Boston,"Boston Security Integration, LLC | Access Control Systems | Security Camera Installation",+1 617-933-1732,curity system installation service · 30 Newbury St 3rd floor,Security System Installers,https://bostonsecurityintegration.com/,3.8
3,Boston,Third Eye Surveillance & Security,+1 617-910-0767,curity system supplier,Security System Installers,https://thirdeyesurveil.com/?utm_campaign=gmb,5.0
63,Boston,MediaBR Technologies,+1 617-807-0100,curity system installation service · 115 Ferry St,Security System Installers,https://www.mediabr.net/,4.9
13,Boston,"AFA Protective Systems, Inc.",+1 866-518-1493,curity system supplier · 200 High St,Security System Installers,http://www.afap.com/,4.7
31,Boston,JC TECH BOSTON INC,+1 617-759-0080,curity system installation service,Security System Installers,http://www.jctechboston.com/,5.0
5,Boston,Boston Alarm,+1 978-821-4102,curity system installation service ·  · 85 Franklin St,Security System Installers,http://bostonfirealarm.com/,5.0
1,Boston,AAA Alarms and Fire Protection,+1 617-465-2171,curity system supplier · 149 Strathmore Rd,Security System Installers,http://aaaalarms.net/,5.0
175,Boston,Wayne Alarm Systems,+1 781-418-5282,curity system supplier ·  · 424 Essex St,Security System Installers,http://waynealarm.com/?utm_source=google&utm_medium=organic&utm_campaign=gmb&utm_content=lynn,4.7
2,Boston,Boston Intercom Group,+1 617-325-3131,curity system installation service · 61 Locust St Unit 545,Security System Installers,http://www.bostonintercomgroup.com/,5.0
19,Boston,"Black Lab Alarm, Inc.",+1 781-938-5502,curity system installation service · 300 Wildwood Ave #220,Security System Installers,https://www.blacklabalarm.com/,4.8
3,Boston,"Prestige Security Solutions, Inc",+1 781-253-8877,curity system supplier · 139 Mystic Ave,Security System Installers,https://prestigesecuritysolution.com/,5.0
68,Boston,DMI Auto & Alarm Services,+1 617-825-1188,r alarm supplier ·  · 837 Blue Hill Ave,Security System Installers,https://www.dmiauto.com/,4.9
1,Boston,SafeStreets Home Security Rhode Island,+1 401-284-9029,curity system installation service,Security System Installers,https://www.safestreets.com/home-security-systems/rhode-island/?utm_source=gbp&utm_medium=organic&utm_campaign=gbp_rhodprov,5.0
1,Boston,"Boston Security Integration, LLC | Access Control Systems NH | Security Camera Installation NH",+1 617-933-1732,curity system installation service · 142 Pleasant Valley St #210B2,Security System Installers,http://www.bostonsecurityintegration.com/,5.0
